,UserName,Contents,Label
461,하늘의 뜻,<U+2764><U+2764>국민은 분노한다 <U+2764>문재인 퇴진<U+2764> 정경심 사랑해요(문빠)<U+2764> 문재인 하야 5가지 이유<U+2764> <U+2764> <U+200B>1. 한미동맹 파괴 3. 경제 파괴 사노맹 4. 원전 파기 5. 4대강 해체6. 국제 외교 왕따 7. 주사파 고려연방제<U+0001F56F><U+0001F56F><U+2744>취업은 알바레오<U+2744>경제는 망칠레오<U+2744>경님은 사기레오<U+2744>기업은 조질레오<U+2744>노조는 키울레오<U+2744>조국은 나쁠레오<U+2744>조민은 바보레오<U+2744>국민은 속일레오<U+0001F329><U+0001F329><U+0001F329>■ 文 하야하라오<U+0001F1F0><U+0001F1F7><U+0001F1F0><U+0001F1F7><U+0001F1F0><U+0001F1F7><U+2764> <U+2764> 조국 당장 구속,0
2650,해리포터,대한민국이 앞날이 걱정된다 큰일이다 본색이 드러났구나 무서운사람이다,0
1748,wjtb****,이게 무슨 나라냐  조작과 선동하는 나라  국민을 둘로 쪼개는 나라  검찰을 언론을 장악할려는 나라  청와대참모진 수준을 보나 대통령 장차과인사하는거 보나 세계 어디도 이런나라는 없다  여론조사 아무도 안믿는다,1
1476,jbc0****,조국과 박근혜의 차이는 조국은 온갖 비리와 불법이  다 나왔는데도 이  촛불 정권은 보호해주고 박근혜는 촛불이 흔들어서 의혹만으로 구속 먼저 시켰음,1
106,answ****,이낙연 이새끼야 변호사 올때까지 손도 안대고 두시간을 기다렸다는데 보통사람 들은 상상도 못할일이다 이놈아,1
44,광야의 소리,잘합니다이 썪어빠지고무능한 정권을  퇴출시켜야나라와 국민이 살수있습니다,0
673,영도,가짜뉴스 유포자들 엄단해야/./.,0
2787,sweetman,"난 이런새>끼들이 제일 싫어 개념없고. 정치감 떨어지고. 고추가루 뿌리는 쌔>끼들 금태섭,박용진.표창원.김부경.   .......",0
2938,kth5****,"“동양대 영재프로그램 참여해 봉사를 했고, 국비지원으로 책 만드는거에 조교역할을 했고, 엄마는 센터장으로 있었고, 봉사 표창장은 위조 문서다” 이게 결론인가? 사문서 위조혐의랑 입시방해에 의한 업무방해혐의도 있는거고? 총장은 자기는 표창한적 없다고 상장번호와 양식을 확인시켜줬더니 문서가 다르더라~ 이래도 가짜뉴스입니까?",1
239,가을의전설,입만 열면 거짓말,0
922,yeun****,소름끼친다 이정권망해라고 하고싶다정녕 제정신인가?이런자가 법무장관이라니~나라가 어디로 가나~,1
3090,산신령,윤석열 !전두환을 꿈꾸나 ?임명권자의 국정 철학이 못마땅하면 내려와라그리고 정치에 나서라.사람에게 충성하지 않는다는 말은충성할 사람이 없다?그러면  충성은 받겠다?윤석열 !무엇을 생각하고 있나?자신에게 정직하고 그 길을 가라품위 있게 가라!,0
1149,산골로간스님,"검찰과 대검이 왜 이렇게 까지 설치나?뒤가 많이 구린데가 많은 모양이다.조국 별로 맘에는 안들지만,검찰과 대검이 움직이고 자한당이 무조건 반대하는걸 보니,조국은 반드시 법무부 장관이 되어야 한다.",0
444,갈매못,"일부 댓글이겠지만 수준이나 편향 정도가 너무 지나친 것 같습니다. 김정일 옹호대와는 다르겠지만, 비교한다해도 할 말 없을 정도입니다. 같은 공간에서 같은 언어를 사용하고, 숨 쉬고 사는데, 이렇게 다른 사람들이 있는가?사상이나, 신념, 편향, 진영이 무섭다는 생각이 든다.",0
327,아미,봉사활동 표창장은 중죄!! 계엄령 내란모의는 불기소...세상  참 요지경입니다..에혀 ㅜㅜㅜ,0
567,마른장작,야아도 조국스럽게 고상한척 하네,0
2348,pds4****,국민들을 멀로  보는건지전  정권보다 더하면 더했지나은게  뭐가 있냐고 말로는 다  할것처럼떠들더니  뒤로는  더 지저분  하자너,1
1001,arir****,조국사태로 사회분야별 좌파들이 얼마나 썩었는지 확인시켜줬습니다,1
1462,쑤니~*,기자야  이런식의 글은 속보이자너 왜그렇게 사니?짜증난다야,0
995,icys****,조국을 두둔하고 감싸는 자들은 나라팔아먹은 역적과 다름이 없으니후일 이들을 반드시 처단해야 나라의 기강이 바로 잡을수 있습니다,1
226,white eagle,"조개국.너  나 좀 보자.정말 인간도 아니네.넌 웅동학원과는 전혀 관계가 없다며?  그런데, 너무 관계가 깊네?  너는 알지 못한다고 C부리겠지만, 그러나 너는 곧 빵에 간다.그런데 니 동생이 거액을 받고 교직을 팔아 먹었더라 그지?  그 돈을 다 먹었겠니 그지?  사람들은 다 알거든.너희들의 더러운 장난질을 알아.   법대로 하자 이거지?    그래.   국민들이 심판을 할게!!!!!!!!!결국 너희 일가는 사기꾼 그것도 아주 사악하고 더러운 악마들이야.",0
2323,김대식,자기를 임명한 사람을 불과 2개월만에 압박이라.. 그것도 대통령을..  이렇게 보고 있는게 이 나라 국개의 현 상황이다.,0
645,yaim****,돈독이오른넘이 법무장관? 참 잘도허것다?  저소득층 장학금까지 ㅃㅐ처먹고 배부 르디? ㅗ,1
1223,도담,조국이 뭐가 무섭냐?!저런사람이 법무장관을 한다는게 무서운거지이나라가 어디로 가려고 이러나.,0
1591,253101500,문재앙과 조국의검찰개혁은 공산주의적화가 목적이다이것들이 헌법에서 자유를빼자고한 민족의반역자들이다문재앙 어디서 국민과 검찰한테 협박하냐개정은 똘마니 개정은대변인 구속 조사하라,0
2517,yg90****,역시 호남은 적폐를 끌고 가는 꼴이 무능한 문재인과 같네? 그러면서 광주가 민주항쟁 도시라고 말하지마라.부끄럽다 !,1
1737,김복순,"저는 정치에 큰 관심이 없습니다. 그런데 TV를 틀면  조국에 대한 뉴스가 나오니 안볼수가 없더군요, 11시간 가택수사 등 가족 사생활 등 ....요즘 보기 싫어 TV를 꺼버린답니다.이제 하도 많이 보다보니 조국이 휼륭하게 보인답니다.정치는 모르지만   이렇게  댓글로라도 응원하고 싶습니다.",0
510,미르k,조국 딸 하나 때문에서울대 고대  부산대가  똥통 대학교가 되는구나,0
1997,wanj****,쇼로 흥한자 쇼로 망한다.,1
733,jjg1****,부부가 금슬좋게 나란히 학교물품 밖으로 막 가져나간게 되는거고 그게 아니면 조국이 청문회에서 거짓말한거구먼. 암튼 둘 다 정상은 아녀.,1
305,반민족독재부패척결,"요즘  떡검이 하는 짓을 보면 ,  검찰  독재를 보는 듯하다이승만 독재박정희  유신 독재전두환 신군부 독재 까지  싸그리  다 뒤집은 국민이다떡검  너거들도  곧 국민들이  바로잡아 줄께",0
2961,명품남양주,기회주의양다리,0
2095,혜주,한겨레까지 손절한 거 보면  조국 조만간 자진 사퇴 할 듯   근데  그게 다가 아니지  드러난  의혹으로도  검찰수사 받고 사법처리 되야 함  ~~,0
901,너의바램,자한당도 똑같이 털꺼지?,0
1920,coke****,모두들 궁금해하는 문다혜 왜 동남아로 피신했는지 묻는 사람 한명 없는 것도 의아하네.아버지가 만드는 살기좋은 대한민국에서 왜 못살고,1
1907,1972****,국민과의 소통에 감사합니다~,1
751,달빛산행,20대 학생들이라   아직 세상을 몰라서 저러지니들의 그런 순진한 기준에 맞는 완벽한 인물은 없단다큰 줄거리를 보고 촛불을들든 데모를 하든 해라니들이 그렇게 데모한다면   자한당 바미당같은 한심한 정치집단아래에서    살아야한단다 큰흐름과 역사를 보고 행동해라 학생들아,0
2717,라라,이분이 민주당 살린줄 알아라소신과 양심에 박수를,0
1943,숲지기,좌파에 위선자들이 한둘이아니지만...조국...너는 진정 탑오브탑이요..쓰레기중의 쓰레기다...니들가족끼리소송은 법을 아는넘의 조언하에가짜소송넣고 일부러져주고기보에 국민세금 40억 빼먹은사기행각이다...넌 이제 학교로도돌아가지 못하길 바란다... 이 쓰레기야,0
2824,김상옥,윤석열님   가족사기단  조국   낱낱이   다조사하시고   덤으로  문재인까지같이해서   이번기회에   청소좀해주셔요    가족사기단이  법무부장관  개가웃어요   제발  문재인  조국  지구를떠나라,0
16,푸른하늘,검찰을 난도질하고검찰을 매도하고검찰을 욕하고검찰을 비하하고검찰에게 나라를 어지럽힌다여당대표가 여당원대 대표가여당의 대변인이정부의 총리가정부의 대변인이청와대와 관변 단체와 지지 세력들이 여당의 왹곽 마이크들이 다 달겨들어검찰에게 몰매를 가하고 있다 조폭처럼 얼마나 무능력하면 무기력하면 집권세력이 창피한줄 모르고 자기 지지세력을 모아 집회를 하나,0
1021,.,윤석열    아직  잘한다. 권력에  무너지지마라.,0
2633,jsle****,어떤이가   조국현상이라고   올린글인데   기회는   가로채고   과정은   조작하고    결과는    날 로   먹었다!!    대한민국   수험생  부모들과   자녀들에게   좌절감과   좌괴감을  주었다,1
1199,mywa****,아마도 기생충이란 영화는 조국가족들이 표본일지도 모르겠다??!!,1
1708,top1****,니네들이 그러니 조중동 소리를 듣는거야..~언론이 언론 역할을 몬하고 기득권의 뒷치닥거리나 하고 있으니..~~쯧쯧..~~,1
1460,별의나그네,200명 온 태극기 집회랑지금 검찰개혁 집회를 비교하는거냐?기계적 균형 꺼져라.니들이 그러니까 기레기라는 소리를 잡아 쳐드시는거다. ㅉ,0
370,cjdc****,정말 한번도 경험해보지 못한 나라 맞네,1
654,makj****,"서울대,더러운것들....끗발좋은조국한테 잘보이려고 서로묻지마장학금줘놓고 이제와서 깜빵갈거같으니전부 오리발....형편어려운학생에게갈 장학금이 이렇게 줄줄새고있는데 서울대생들은 뭐하냐? 한심하다....",1
2302,jiew****,`■ 50억대 자산가 ~조국 ! 돈독에오르다-----서울대교수 월급845만원~부산대 의전 6학기 장학금.서울대 장학금.자기소개서 판매등등을 보태서 돈모으기~집안가족들은 온갖 편법으로 돈모으기~~~,1
3024,못난도깨비,검찰개혁 조국장관님 아님 안됩니다.꼭 조국장관님이여야 되어요저런 멘탈.결의. 가족이 저런 수난을 당하는데도.본인의 본분을 다 하겠다는 의지에감동입니다.조국 응원합니다.,0
2867,7000****,문가 조가는 경제공동체? 합리적 의심이 든다,1
1287,jiso****,이정도면 사퇴가 답인듯 .조국씨 검찰개혁은 깨끗한 사람에게 맡겨두는게,1
840,땅꼬마,"최근 일어난 여러가지 일들을 보면 소위 상류층 사회가 얼마나 부패하고 적폐가 심한지 짐작할 수 있다.재벌 3세들의 마약 관련 사건, 고위 공직자 자녀들의 특혜성 입학, 다양한 편법의 치부(致富) 등등..........어리석은 국민은 그들에게 개돼지로 보일 수 밖에..........",0
1883,engj****,빨갱이 문재인과 좌빨들의 민낯. .요즘 문재인 만큼이나 없애고 싶은 심상정  년,1
1995,grad****,총선 다가오니 별짓을 다하는군. 당신이 언제 부터 소통을 했다고 진정한 소통 였다면  계란 으로 목욕 했을터. 이제와서 조국 관련 송구 하다며 또 그뒤에 검찰개혁 이라는 사족을 갖다 붙이냐. 진심 으로 송구 하다면 검찰 수사를 겸허히 받아들여야지...  온갖 압력 으로 수사 방해 하면서  어찌 저리 뻔뻔할수 있을까 싶다.,1
180,밝은몸,"표창장 위조하고증거 인멸하고도 안했다고 하고,입원증명서도 위조한거 아니야?",0
1748,earthy,대통령 님은  즉시 검찰 반란 진압하고 윤석열 체포하시요,0
147,onji****,악플다는 알바생들아 현생 살아라 그리고 밖에 좀 나가봐 얼마 받고 영혼을 파는진 모르겠지만 여기서 니들이 현실 부정하고 악플 단다고 세상이 니네가 원하는 방향으로 흐르진 않아,1
2112,kjn2****,국민들은 죽창을 들고 일본에 맞서라 내 딸은 시험한번 안보고 외고 고대 의대대학원가서 의사하고 병원장할꺼고 내 아들은 미국 국적도 있고 대학교수하다가 대학교 총장할꺼니까. 니들 서민 자식들은 죽창들고 나가 싸워라,1
2399,hae418,파디수첩을보며  아무상관 없는 저도 이렇개 분하고 치가 떨리는데 조국가족들은 그동안 억울해서 어떻게 살았을까요?특히 조국장관이 청문회에서 저 표창장으로 자한당  장재원같은  (불법이나 저지른 아들 둔 ) 쓰레기애게 겪은 인간적 모욕과 조롱  멸시를 생각하면  눈물이 날 정도입니다.,0
752,13lu****,내평생살면서  그무거운피씨를  한명도아니고한집에 두명씩이나  것도 사람을시켜서까지 집까지낑낑나르고 하는인간들첨본다...진짜 쟤는 저걸남들보고믿으란소린가?,1
1990,이짱구,조국과. 문째인만 같아라재산들은저정도.  자식취업방법도. 저정도면 이나라. 법치가.  되는거다저런자가. 법을 집행하고. 저런자들의. 자시교육이. 모범적으로. 하는나라. 이북의. 김정은보다 더 나쁜지는.   두고보자,0
484,cool****,아니 서초집회에서는 또 조국 반대집회 참가자수도 엄청났는데요? 그분들 빼면 ㅋㅋㅋ 광화문이 열배 많음,1
222,gons****,이거  딱 보니 조범동이 한테 다 덮어씌우고 꼬리 자르기 할 모양이네~   국민들이 아직도 개돼지 인줄 아나~민주당 정의당 은 반드시 후회하게 될거다!,1
600,gree****,"서울대도 의전원 가려고 잠깐 이용한거고, 그 와중에도 3학점짜리 한과목만 신청해놓고, 한학기에 장학금을 400만원씩 받아 쳐먹었더라~~~~ 지금까지 열심히 학자금 대출 갚아온 내가 ㄷㅅ인거지! 조국이는 나라돈은 전부 안갚고 탕감받았던데...12억은 6원으로.... 동생놈은 40억 떼어먹고, 재단돈은 가족이 담합하고 사기쳐서 50억 가로채고.....",1
2495,물구비,"조국이가  망조가 드네. 달도 차면 기우나니, 누구 글에 그만하면 되었으니 만족하고 내려 오너라. 그렇지 않으면 땅으로 떨어져 죽창에 찔려서 사망에 이르는도다. 이제 강단에 복귀하면 만신창이가 되어서 교수질이라도 제대로 하겠어요. 수사에 결정적인 권력 개입은 사모펀드에서 윤석열이가 필리핀으로 토깐 5촌 조카 잡아 들이면 금방 들어 난다. 그리고 잡범은 몰라도 한국에 재산이나 근거지가 있는데 오래 필리핀에 머물지 못합니다",0
36,민긍호,몰아내자 미꾸라지 때려잡자 쥐새끼 죽창정부 썩었구나 죽창들고 감옥서 반성하고 깨우처라 머지않아 신적폐당(민주당 )은  사라진다 열린우리당도 그랬다 부패하고 썩은당이다,0
814,keus****,정의는 죽었지. 서울대에서.,1
1486,cyjp****,우리 애가 영어를 잘해서.......키스트 인턴 틀림 없이 했구요.....참 애비가 요물이다.,1
2880,권경자,조국 을 사툉시킬 분은 윤총장 뿐입니다 국민 기대롤 저버리지마시고 꼭  사퇴시기십시요,0
603,stor****,"까도 까도 계속 나오네. 이건 실력으로 고등,대학,의전원 간게 아니라 철저한 기획작품으로 만들어진거네. 반드시 검찰조사 시작해야한다. 서울대도 감추고 있네. 지방대도 학생관리 저렇게 하진 않을거다.",1
2148,닉네임없음,구업입니다  사퇴하세요,0
770,hyun****,그니까요국립대교수가 학교서 쓰던 PC집으로 가져가서 쓰셨다네애를 지키려고 본인의 도덕성을 내려놓은건가아니면 정말 조국이 의학논문 수정을 해줬는가싹다 수사해서 명명백백  밝히자 반성없는 사람에게는 진실이 답이다,1
1045,iskf****,"이 나라 희망이 있는지 모르겠다. 불법, 편법, 거짓말, 위선, 비리의 온상인 조국같은 사람이 법무부 장관이 되고 또 임명시켜준 대통령! 이런것들이  분노케하고 허탈하게 만든다. 양심도 부끄러움도 모르는 조국, 북한밖에 모르는 무능한 대통령! 나라가 몇년만에 완전 망가졌다",1
2207,dauc****,한마디로  이것도 꼴지인데 상받은거고 부산대도 꼴지인데 장학금 받은거고 단국대도 꼴지인데 제1저자로 올라간거고,1
1533,kgse****,"대한민국 검찰이 이대로만 해준다면, 기득권 비리에 이만큼만 애써준다면, 검찰은 어디에서도 가져본적이 없는 지지를 받게될 것이다!  검찰은 정치권 따위 믿지말고, 광신도들 돌아보지 말고 국민만 보고 나가면 된다. 검찰, 화이팅!",1
516,ultra5803,서울대 학생회장은 토착왜구당 졸개라고 확신한다!!!!!!!!!!!,0
2244,kj66****,대체 정유라때 헌법강의하고 입시강의하던 법잘할 교육잘알들은 이번 정권에서 다 뒈졌냐?? ㅋㅋㅋ,1
276,angl,우찌 그렇게 비열한 것이냐? 조국!!!실체는 본인이 했는데... 끝은 모른다... 수십가지 관련 사건을 그렇게 피해가냐? 니들은 옳고 주위인물들 온통 나쁜사람들 인가벼.... 허허 안타까울시고....X차고 나왔으면 좀 당당해라!!!  사건의 시작은 너희들이 보이는데 끝은 없네... 대단한 사람들일세...,0
2084,코리,"진보냐, 보수냐를 떠나서 쓰레기가 아니면 정치를 못 하는건가??",0
906,구름다리,"윤석렬검찰총장님,화이팅, 검찰이 바로서야 나라가 온전하다,정권은 바뀔수도 있지만,검찰의 임무는 바뀌지 않는다",0
1427,의욕과특별함사이,"외신보도 대한민국 사법부 검찰 개혁을 위해200민 시민이 촛불을 들다검사의 권한을 나라별로 예시대한민국에서 가진 검사의 권한기소독점, 수사종결, 기소편의, 공소취소, 기소권수사지휘, 자체조사, 조서능력, 영장청구, 체포구속장소 감찰, 경찰징계, 변사체 검시, 피의자 석방지휘, 압수물 처분 지휘.이 모든 권한을 다 가진 검사대한민국 검사 권력의 기형적 큼을 바꾸지는 촛불문화제 보도를 외신보도로 보도 되어야 한다",0
1874,석이형,상식적이지..빤스를 내려보라고 하는 개독먹사가 헌금걷고 있으니..그런 집회에 애들 데려가는게 부모냐?아동학대지..상식이 뭔지도 모르는 것들이..ㅉㅉㅉ,0
1721,bbqk****,여론조사기관 수사도 중요하지만...더 시급한건 총선을 얼마 안둔 상황에서 선관위도 조사해야해....지난 경선.대선.보선.지선...더불어공산당이 다 장악한 이유는 선관위의 공로다...투표를 조작하는건 국민의 주권을 짓밣고 강탈한것이다~! 사전투표.인터넷.핸드폰투표 없애고..현장수개표 해야돼~~!!!,1
2474,RED WINE,사기당한걸..자한당이 알려줄 줄이야...자한당이 잘하는것도 있네,0
966,사랑하며 살기,조사는 철저히  해야지.,0
185,lmhl****,설령 여자만 둘이 있었다해도 가냘프고 청순한 여자이기나 하냐? 악랄한 범죄혐의를 은폐한 괴물같은 남자보다 더 무서운 여자를 그렇게 확인도 제대로 안하고 감성팔이를 해서 여론을 호도하려고 하는 작태가 안스럽기까지 하다.,1
1895,donkey,문재인 빨갱이 몰아냅니다!반드시!!!,0
2332,호구,윤석렬 멋지다,0
135,ASTRAL,원본 제출하면 그 병원도 압수수색 들어가나요.누가 검새들 겁나서 진단서 떼어주겠나.,0
215,jung****,정말 기생충 가족이네. 저런 놈이 사회지도층이라구? 썪어도 엄청 썪은 사회구만.,1
1025,선견지명,조국이 아니라 밍국이다,0
1092,leey****,죄국 문죄인 두놈 척결해야 대한민국이  산다.,1
1458,jssh****,와 이거 너무하지않냐 논문도 취소돼 이사람은보직 해임됐는데 조민은 아직 의전원생이며 조국은 꼴랑 한달 장관 해쳐먹고 서울대 교수복직ㅋㅋㅋㅋ문슬람들은 서초동가서 조국 수호시위하고 ㅋㅋ,1
417,faip****,태극기집회 vs 촛불집회가 아니라 애국집회 vs 매국집회나 상식적이고 합법을 추구하는 집회 vs 비상식적이고 불법을 조장하는 집회라고 해라 조국이나 문재인이 무슨 진보라고 보수 진보 대결로 몰고 가는지 진보가 불법 편법을 추구하는 이념인가,1
2732,dmnc****,본인은 부르조아의 좋은것은 다누리면서 대가리는 프로레타리아 정신으로 가득찬 위선적인 인간이네.현 정부를 구성하고 있는 놈들도 다를거 하나도 없지만....,1
407,repf****,박대통령 탄핵시절 촛불집회이후...광화문 집회..개천절..한글날 참석했지요..엄청난 인원이었어요 제주에서 비행기 타고 오신 젊은 부부와 아이들 고사리 손 붙잡고 혹은 무등을 태워...참 많은 사람이 왔습니다.현정부에 실망하고 화가난 분들이 모두 함께하였다는 겁니다. 20~40대..층이 아주 많았다는게...아주 달라진 모습이었지요.취임사와 정 반대되는 현 사태를 문대통령만 기억을 못하는것 같습니다. 충언하는 민주당의원도 한명도 보기 힘들고 대통령부터 여의원들까지..전부..조국 대변인을 하고 있는걸 보니...기가막힐 뿐입니다.,1
168,pont****,조국 옹호론자들 보면. 문재앙  이낙연 이해찬 박지원 유시민 심상정 임종석 박원순 이재명..하나같이 말다르고 행동다른 사기꾼 놈들이야~,1
586,따오기,"친일파 이영훈, 나경원국정농단 김기춘, 우병우수구꼴통 김문수, 김진태를 비판하는 집회를 연적이 있던가?누가 우리 사회의 병폐인가?",0
1118,acti****,그나마 조중동같은 언론이 없었다면 국민들이 까맣게 모르고 있다가 나라 뒤집히고 나서야 알게 됐을 것이다... 국민들이 이번에 조중동에 신세를 많이 졌다고 본다...,1
1646,inpi****,공수처 반대!! 더불만젖당 해체!!!,1
1465,myma****,조민이가 사람 여럿 보내는구나..그래도 자기들은 잘못한거 하나도 없고 억울하다고만 주장하지. 니들 눈에 니들때문에 피해본 사람들은 안중에도 없지? 그게 니들 한계야,1
133,suno****,아~ 딸 둘만 있었던게 아니었구나. 속을뻔했네 ㅡ.ㅡ,1
83,나무꾼,조국 검찰 개혁이라고 내 놓은게피의자 스포트라이트에 서지 않는다는거지가족 보호하는거지그게 무슨 개혁이냐전세계에서 스포트라이트 서는건 다하는데헛소리 하는거봐,0
1758,Justice,"겨우 표창장때문에 법무장관 아내를 공개소환으로 망신주고, 구속영장 쳐봐라!오늘은 200백만의 촛불이 모였지만,다음주는 5백만, 그 다음주는 천만 국민이 검찰과 사법부를 심판하러 모일거다!깨어있는 시민여러분!지치지 맙시다!포기하지 맙시다!이번에는 지켜냅시다!이번에는 검찰개혁 이뤄냅시다!우리가 바로 조국이기 때문입니다!",0
3014,ms95506,문재인이  독재자이거나 언론을 탄압했거나 검찰에 권력을 사용했다면 조국이 저렇게 탈탈 털렸겠니?? 적폐들과 추종자들은 머리가 없니??,0
1191,헛발질,멋같은 세상  문죄인   조국이 먼저다. ♪~의  문제있는당   조국임명하면 촛불에 망한다,0
2540,don,이 정도까지 만신창이가 되었는데도 굳이 사퇴하지 않는 이유가 궁금하네...조국 본인의 정신에도문제가 있는것 아닌가 ? 누가 봐도 자식들 스펙 쌓아주려고 백방으로 노력한 것이 분명하구만불법적인것은 아니었다고 넘어가겠다는건가 ? 그런 사고방식을 가진 사람이 그동안 국가의 인사를검증하는 자리에 있었으니 그런 해괴한 인사가 나라를 이 지경으로 빠뜨렸구만...그런 이가 또검찰을 개혁하겠다고 ? 조국 당신이 바로 개혁의 대상이며 적폐의 온상인데 어떻게 검찰을 개혁한다는건지..,0
2183,ange****,진짜 가지가지하네그렇게 고고한척 깨긋한척 했으면서 결국 자식문제에 있어서 본성이 드러나는듯,1
755,jyj6****,사악한넘. 거짓말도 고상고귀하게 하네.  오상방위도 몰랐던넘이 고상한척하며 여태 밥벌이 해처먹었구나.  감방가서도 고상한척 하며 살거라. 오상방위는 필히 대가리에 기억해 두거라 돌대가리야.,1
318,골프파크,공수처가반드시필요하다!!,0
1194,qoff****,사기 전문가가 대학교수라니... 조국 딸도 짜가로 박사시키고 교수만들었을 게 뻔한거 아닌가? 대한민국은 썩었다. 통탄스럽다.  국민모두 일어나자!,1
1885,제니퍼,"* 선거하면 결과가 다 나오는데천하에 <U+0001F415> 사기꾼, 기생충 간첩 매국노 문디가 조작만 해대니~ 믿을수가 없지요!!<U+2666><U+FE0F>매국노 기생충 문재인은 탄핵해야 하고~탄핵이 시작되었습니다<U+0001F607>",0
2263,지구지킴이,한겨레인데도 기레기탓 하냐? 광신도들,0
763,낙장불입,한심한 국회의원들 밑천만 확인조국은 반드시 임명 찬성~,0
