,UserName,Contents,Label
216,loze****,하나라도 멀쩡하고 범죄 안저지른 사람이있냐?ㅋㅋㅋㅋㅋㅋㅋ역대급 가족범죄단이네 그러면서 어떻게 그렇게 가증스러운짓을 하고 지금도 하고 있고 하....누가 조국일가랑 문재인 단두대로 공개처형해도 아무 느낌 없을 것 같다,1
2350,원성환,윤화이팅,0
2173,xowl****,똥묻은 조국이 겨뭍은 순실이보고 뭐라한겨??,1
2938,강송희,"심상정. 양다리는 옳지않아.,",0
412,1hee****,팩트는  서초동보다  광화문시위자들이  많다  그렇지만  좌파들은  팩트에  등돌리고  지들 할말만  떠듬,1
2577,jcm9****,조국이도 사람 축에 들어가나,1
2825,gtoo****,검찰 믿어본다. 짜고치면 폭동각이다.,1
864,qkqk****,정말 대한민국의 정의와 공정이 죽었습니다.문재인 탄핵 찬성합니다.,1
2890,2638****,윤석렬 지지한다당신의 소신은 믿음이갑니다,1
2394,행운아,윤총장을 놔둬라.니들처럼 이렇게 전방위 검사의 권한을 좌지우지 하려는 정권은 없었다.5공이냐??,0
244,vin3****,조국이 있었기에 가능한 것이였다. 조국은 모른다.는 것은 지나가는 바둑이도 웃고 가겠네. 설상 모른다고 해도 가족이 수사받고 구속되는 과정에 꼭 장관자리 앉고싶은지... 문재인의 능력은 이 나라의 성장도 국민의 생각도 없다. 개인의 업장과 북한 경제개발이 우선이기에.,1
623,wind****,정말   뻔뻔  하다    당신이 거울을  보고  장관이 될 만한 사람인가  한번  보시요 제발   정신차리고  벌 받아라,1
2661,mach****,같은 40대인데 참 창피하다... 뭐 저런 유치한 짓을 할까. 난 저 대깨문들이 광신도같단 생각.,1
1771,블루데이,민심은 이미 돌아섰다문통 민주당지지율 폭등왜구당 반토막 ㅋㅋ개검과 적페들 사기쇼 들통나국민들 분노폭발이제 왜구들은 문닫고우리일본 대일민국으로 가라대힌민국에서 지지할 국민은 한명도없다 ㅋㅋ총선 대선힐 필오도 없네황대갈 머리도 밀었는데 어쩌냐그냥 왜구들 데리고 절로 가거나 군대나 가라~~ㅋㅋ,0
259,gree****,조권 이거 기각한 판사 우리법얀구회 출신이라매? 에라이 적폐판사야 조국 시다바리라니까 살람살이 나아졌냐?!!,1
2982,수기wks,젠장 이건 뭐 상왕이 따로 없네  대통령의 고유 권한인 임명권을 왜 야당들이 좌지우지하려 하지 조국 장관 그냥 앞만 보고 가세요,0
2196,켈리,조국은 증거도없이  피의자라니...노무현전대통령 때처럼 적폐검찰이 또 덮어씌우려고하냐조국 응원합니다,0
481,테페리,경향..니들이 더 나빠...희곤아..평생 이 기사가 널 따라다닐거다.,0
748,khan****,13억은 알아 보지도않고 1년에 1번보는 천척한테 맡기고 신경끄는양반이 공공자산 중고컴퓨터를 집으로 들고가서 딸이랑 같이 썼데..ㅋㅋㅋㅋㅋㅋ 미치겠다. 이런데도 쉴드치는 대깨문들...진짜 답없다.,1
946,dlqu****,도독놈 조국,1
1682,대한민국맨,윤총장이 최근 무슨 잘못한것 처럼청와대 및 언론에서 떠드는데무슨 잘못을 한건지 자숙하세요쪽팔린다 국민수준은 촞불 들기전에 왜 들고 있는지부터알고 들어라 나라 망신개혁은 윤총장이 알아서 할건데 법도 모르는 사람들이 촞불들고개혁을 외치는지 안타깝다,0
741,mchk****,"딸은 유급되었음에도 몇 년간 장학금을 현금으로 챙겨~애비 애미는 서울대, 동양대에서 학교 재산인 컴퓨터를 통째로 들고가~~니네가 60 억대 재산을 모은 이유를 이제야 알겠다, 아주 돈에 미쳤구나ㅋㅋㅋ 저 두 인간들을 절도죄로 고소합시다",1
789,지상파랑새,기자양반  자식은  어떻게 공부 잘하구 봉사도 잘해요?자식 시험 보는데  어떻게 도와  줄려고 하는게 대다수 일껄...자한당자식은  KT도 그냥 들어 가잖아...시험도  원서도 안내구...,0
567,kkau****,어떤사람들은 재인이가 국론분열을 방관 한다고 하는데 그게아니라 재인이는 국론분열을 조장하고 있다 그것도 아주 비열하게,1
101,crou****,국무총리란 사람이 가짜 뉴스를 배포하네.,1
1100,gyu0****,나라가 미쳐 돌아가는구나. 사회주의자들이 행정부 국회 법조계 교육계 노동계 국방 문화 심지어는 연예계까지 .. 정말 심각하다. 어릴때부터 자유대한에서 아무 문제없이 살았는데 지금 어디가서 난 우파다 라고 하면 암암리에 불이익을 당하고 이상한 사람 보듯이 한다. 이게 민주주의냐. 이게 나라냐,1
251,지야,야~~~어제 여검사가  실명까고  검사장이야기 해주대. 유희곤   그래   기삿거리없으면  검사장파라. 니가 검찰개혁 할수도 있다.  밥쳐먹고 개떡같은  기사쓰지말고~~~쉐끼 기레기야,0
744,뿌리깊은나무,청문회를 지켜본 결과 조국 후보자와 관련 많은 의혹들이 해소되었고큰 흠결을 찾을 수 없으므로 임명함이 타당하다,0
126,tont****,"거짓말 하지 마세요!  총리!  여수사관1,여검사1 변호사3  조국식구3  그리고 검사와 수사관. 국민도 다 아는데, 총리도 한통속? 전 날과 다르네!",1
3075,에버그린,개혁은 이제 시작이다검찰아 이게 끝이 아니고 시작이다국민이 있고 너희가 있는거다우리가 준 권리를 너희의 사리사욕에 쓴다면 그 권리는 내려놓아야 이치에 맞지 않겠나,0
1202,평민인정,ㅋㅋㅋㅋㅋ 자한당 패스트트랙이나 조사해 너무 명확하잖아,0
416,mail****,"문재인 지지율 20% 지지안함이 80%, 4배",1
275,BlueThunder,ㄱ H /\H ㄲ ㅣ 들아. 그래서 어쩌라고?,0
1977,김영대,조국이는우리 밥 그릇 뺏지마세요개그맨 일동,0
981,qaz6****,정황상조국이한짓맞네,1
2256,조로,쫄지마!!!!윤석열 총장님!!!!!!!!수구진보와보수 쓸어버리시고 주권은 국민으로부터 나오는 진짜 대한민국만들어주세요!!!!!!!!!!,0
1707,gusw****,"저는 택시를 하는  사람입니다하루에도 평균 30번정도의 많은 손님을 운행합니다손님들의 문재인대통령과 지금의정권이 좋다 잘한다나쁘다 못한다의 비율을 말하자면정말로 열받고 못한다  80프로,,,,적극적으로 좋다 잘한다가 20프로,,,입니다",1
422,ouio****,안타깝게도 21일 축제와 28일 축제는 규모 자체와 분위기도 달라서 28일 6-8시에 축제를 즐기러 간 사람들이 훠얼씬 많았다는거. 서초집회 표본이 잘못되었어요. 더 인원을 줄여야 합니다,1
1953,숲지기,민주당.....뻔한거에 물타기하려하는거 역겹다.... 그 가족이 소송하는데 조국이 이사장으로 있으면서 소송 일부러 져줬잖아...그러니 기보 40억을 동생부부가 타먹은 거고....  희대의 가족사기단이구만... 어딜 물타기하며 쉴드쳐주려하냐....,0
904,닉네임,윤석열호 검찰은 얼마나 중립적인지 지켜보겠다. 살아있는 권력까지 조준함에 있어서 한치의 망설임도 없는데 야당의원들의 정치공세에서도 망설임없이 임하라. 그럼 인정!,0
2812,정의로운 사회,모든게  민주당은 내로남불이다.  이런 정당을 믿고  지지했던  사람들이  불쌍하다,0
207,유리,유희곤....얘는 진짜 개/돼지가 확실하네 ㅋㅋㅋㅋㅋㅋ,0
3,kimd****,문재인 대통령은 조국을 살리기 위해서 국민을 버렸다..정의는 죽었고..국민들은 허탈하다..국민들의 격렬한 저항을 무시한체 조국을 법무부 수장에 앉히는 행위로 조국과 그의 기족을 향한 검찰의 예리한 칼끝을 무디게 만들었다.그의 가족과 그 자신을 향해 쏟아진 그많은 의혹에 대해서 모르쇠로 일관하면서 시간 떼우기만 했던 조국이 과연 온갖 의혹을 묻어둔 상태로 과연 법무부 장관으로서 떳떳하게 임무를 수행 할수 있을까?대한민국의 대들보인 지식인들이여 살아숨쉬는 불같은 열정으로 대한민국의 정의구현을 위해 분연히 일어나주길 간절히 바랍니다~<U+270A><U+270C>,1
2620,calm****,정치 나이대가 역전됐네.나이좀 먹은 훈수질 꼴통짓 하는 사람들이 예전엔 수꼴이었는데 지금은 좌꼴들임.친척모임와서 문재인 종교짓하는거 너무 싫어.즐겁자고 모인자리인데 조국 문재인 너무 좋다고 세뇌시키려고 하는거 너무 뜬금없고 이상해,1
622,youn****,그래서 특검을해야된다~~,1
2405,흑인이정색하면검정색,압수수색 했더니 ㅋㅋ 돈 불린게 아니고 오히려 사기를 당했네 ㅋㅋㅋㅋㅋㅋㅋㅋㅋㅋ,0
1685,hutch,윤짜장님  PD수첩 봤냐 이 C*8  새퀴야~!!!,0
2330,chri****,부산인들 좀 얍싸하잖아. 조국 같은 자에게 기대서 뭘 노리다니 말이다. 조국은 완전 좌빨이야. 속속들이. 아직 전혀 전향한 적이 없다고 하잖아. 쉽게 말하면 조국 같은 자는 우리나라에 존재하서는 안 되는 자야.,1
934,elmo****,공산당보다  싫은놈,1
1523,rhee****,검찰이 살아 있는 권력을 수사하는 것이 얼마나 어려운지를 이번 사건을 통해서 알게됐다.    윤석열 검찰의 노고에 박수를 보낸다. 화이팅!!,1
1708,아수바리,이걸 균형이라고 쓰는 수준낮은 기레기.,0
1091,헛발질,멋같은 세상  문죄인   조국이 먼저다. ♪~의  문제있는당   조국임명하면 촛불에 망한다,0
909,갈매기,조국을 철저히 조사하여 국민들의의혹을 불식시켜야 되지 용두사미 처럼조사했다가는 국민들의 저항을 받을것이다.철저히 조사하라~흠결이  그렇게 많은 사람인데 구지 왜 법무부 장관으로 임명 할 려고 하나?윤석열 검찰총장 한번 믿어봅니다.외풍에 신경쓰지 말고 조사해주세요~검찰총장님 파이팅~~,0
3086,인정,이번주에 우리 집사람이랑 참석 했는데... 정말 기분 최고 였습니다.등산가고... 다른데..바람쏘이러 갈려면 ... 이런데로 오세요광주 전남은문화예술회관 후문에서 오전 11시40분집결 12시에 출발 합니다.,0
2133,621962696,검찰 이것들이 함구령 내렸다고 하더니만 또 언론에 기사꺼리 주고 있네.느네들이 조국이 안된다고 할수록 국민들이 반드시 조국을 법무장관으로만들것이다.,0
2293,hubb****,인생 쉽게 사네. 중국 공산당 고위급 자제들이 그렇게 인생 쉽게 산다더니 딱 그 짝이네. 지소미아파기로 미일관계 끊어먹고 친중 고려연방 기어이 하겠다는거지?,1
772,백두대간 2,몇놈들 떠든다고신경쓰지마세요.조국법무장관  축하하게될겁니다.3년뒤엔  조국대통령후보다.,0
1240,punisher,검찰 피의자 주제에 어디 감히 니까짓게 법무부장관해먹겠다고 뻔뻔하고 구역질나게 계속 뻐대고 있냐니가 쥬둥아리 털었던 말들이나 다시 되새겨 양심에 심어라,0
2197,디자이너맘,현 국회의원 장관들. 조국처럼 탈탈 먼지털어 보자!  전수 조사 해보자! 자활당들아. 어디서 고상한척이야대한민국을 새롭게 바꿔보겠다닌깐 두렵냐?국개의원 장관들. 조국처럼 가족들 다 털어보자,0
1149,js10****,저런 새끼들 편에서는 김제동같은 넘들은 사회 악이다,1
787,spea****,완전 입만열면 거짓말 영화보는것같아요 사이코패스 영화 어찌보면 말도 안되는 거짓말을 서울대법대교수 수준이 겨우 저런거였나싶고ㅋㅋ,1
1946,well****,대깨문들 모아넣고 쑈하는데 대가리 깨진 애들 수준이 딱 나오는 그런 모임. 징징 거리기 남탓하기 쑈하기 선동하기,1
1410,and1****,"악질중의 악질이네...주변에 도와준 사람들이 죄다 들켜서 짤리고,징역살게 생겼는데도 정작 당사자는 그런일 없다고 배째라하고 주변에서 알아서 했다고 거짓말이나 하고 있으니...",1
341,john,다음 총선에서 공수처 반대하는 국회의원 반드시 낙선시키자,0
872,cdna****,솔직히 순실이 누나때보다 가계부채 더 심함....  외국인 대통령 제 해야 함 .,1
2875,야인,좌빨들은 다그런거야 좌빨들이 하면 로맨스고보수가하면 불륜이야괴 같은 인간들,0
1228,taif****,이 정도로 혐의가 뚜렷한데 대통령이 조국 임명강행을 한 이유를 캐야한다. 설마 모르고 시키진 않았을거다. 분명 약점을 잡혔든 뭔가 둘이 같이 공유하는 비리가 있을거다.,1
2503,enter,조국 딸은 지겨우니 조국 위법사항 좀 올려봐라 없지?,0
2652,와다,"지멋대로 주의자,지멋대로 입학,지멋대로 표창장,지멋대로 기자회견,지멋대로 장관.썩은 정글 시궁창을 헤집는미키 마우스.",0
13,마음편하게살자,대통령이 국민을 반으로 확 찢어버라고 있다.대통령이란 자는 이게 국민분열이 아니라고 한다.상상을 초월하는 분열의 대통령.나원참.,0
2058,rsy1****,오로지 정권 유지만이 목표네요국익이나 국민은 안중에도 없고 제밥그릇만 챙기는 정부!조국 위선자를 사퇴시키고 빨갱이 가짜 대통령 문재인도 탄핵시킵시다,1
2273,희망소년,"가짜, 조작, 거짓...뻔뻔.조후보자를 따라디니는 ..국민의 붅노는 점점끓고있다.",0
637,wooy****,순실이도 장학금은 안건드렸다 이게모냐 그 막나가는아줌마도 지딸 학점안줘서 교수는갈아치워도 지가 돈즘있으니까 등록금은내고 장학금안건드렸는데  그러니까 정유라가 당당히 부모돈도실력이라고 싸지른거지,1
982,1956****,5촌 조카를 내세운 당숙이라는 주범이 있는데도 그냥 깔아 뭉게는 대한미국~ 이것도 나라냐?,1
2377,dbfh****,아직도 정신 못차렸네요. 민주당 말하는 거 보세요. -“추석 후 대선 주자 여론조사에 조 후보자가 거명될 수도 있다”고 했다.고 합니다. 이것들 정말 피박살을 내야 합니다.,1
669,화이트호스,수능 400점 만점에 392점이라는데 천재급이다. 서울대 아무데나 골라서 갈 실력이다,0
505,jung****,문재인 탄핵 조국 구속,1
918,클랑,정말 국민들의 기대에 의긋나지 않는 수사결과가 나오는지 지켜보자.''사람에게 충성하지않는다''는  윤총장의 그말을 진정으로 믿고 싶다.현재 권력에 굴하지 않는 검찰을 보고싶다.,0
660,free99,뭐  김어준하고 인터뷰 했다고?/   그리고  경향신문  ㅋㅋㅋㅋㅋㅋㅋㅋㅋㅋㅋㅋㅋㅋㅋㅋㅋㅋㅋㅋㅋㅋ  이거 믿는   개 돼지 홍  어들도 있냐??,0
1316,민주시민,모두가 거짓말 본인이 진짜조국인지도 조사해보아야 할듯,0
1349,happ****,전국민 홧병 나겠다,1
949,taes****,살다 살다 좃국이같은 파렴치한 뻥쟁이 첨봄,1
269,rokf****,오늘 문재앙이 탄핵시켜야겠다!이게 나라냐?,1
2635,dpki****,이런 말도 안되는 짓거리가 난무하는 이 나라가 정상인거냐?,1
124,빽사리,입원 증명서가 뇌종양 뇌경색 판정 증명서는 아니지요.꾀병 앓다가 모르고 있던 뇌 종양이 발견 되었다면 검찰이 생명의 은인입니다.그만하고 조사에 성실히 임한다면 지긋지긋한 조사도 빨리 끝날것을 질질 끌 필요가없는것을 말입니다.병원 증명서도 혹시 짜깁기 하고 있는 것은 아닌지 몰것네요.,0
537,matt,SKY 들이 기득권 부모들밑에서 어떤 특혜를 입고 사는지 우리 다 아는데... 나는 아닌척  가면을 쓴 집단들사회 정의는 귀찮아하고 내가 손해보지 않는것만 정의라고 여기는 이기적 집단들이영훈 김진태 나경원 김기춘도 부끄러운 선배가 아니고오직 조국만 부끄러워하는 ‘정치’ 집단들그 안에  오늘 처음 들어보는 올곧은 목소리도 있군요...,0
1763,tkdv****,드뎌 터지는구나   여론조사   나한테 전화왓는데   문재인정부잘하고 있슴니까 .  아니요 지금 문재인정부들어서  서민들.자영업  다죽어가고있다 .  문재인정부가 잘하는게  머가있느냐   북한에만 정신팔려   우리국민세금으로  돼지새끼한테 퍼주는 정부  우리나라국민들 서민들 .자영업자들  문닫고  굶어죽는데   하고  이야기했더니만  나이가 어떻게되시냐고  묻길래 50넘엇다하니  여론조사대상이  아님니다 하고 끊네요  열받아서 전화하니 전화받지도 않고  입에서 1  8멍멍이3   키들이라그 욕나오네요  여론조사  전부거짓말임니다,1
3012,pyoonhee,조국장관이  버텨주어서  검찰개혁의  필요성이부각된거라고  생각하며   조국이  아니면  대한민국은  모든것이  다시  촛불 이전으로  돌아가고  말것이다,0
1541,nmmn****,조국  문재인때문에   스트레스많이 쌓였는데  조국 때문에 얻은건있다  문재인  민주당 실체를  다알았다좌빨들이  깊숙히 침투해있다는걸  학교까지정의개혁으로  국민들선동   연론몰이   반대세력들  얼마나 압박했는지   다알았다     우파 유튜버들   죽일려는 공작들까지   난   공산당이 싫어요,1
1688,akst****,무능 독재 타락 종북 치매 문재인은 즉시 대통령 직에서 물러나라. 그리고 미래 세대에 죄를 짓고도 안하무인 민주당도 즉각 해산하라.,1
1880,chos****,지은죄가 얼마나많으면 쥐새끼같이 숨어서 기어들어가냐 ㅋㅋ젓국구속 대한민국 국민이바란다,1
189,루카와,"이거보세요. 진단서에 뭐가 들어가야되냐면, 환자의 진단명, 진단한 병원, 진단한 의사 이름과 서명이 들어갑니다. 진단한 병원 과 진단한 의사 이름, 서명이 왜 들어가느냐? 이 진단서에 거짓이 없고 법적인 책임을 지겠다는 거거든요? 이 구성요소들이 갖추어져야 진단서란 말입니다. 제발 대깨문님들아 ... 모르면 가만히 있으면 중간이라도 갑니다.",0
845,0606****,엄마 아빠 덕 안 보고 서울대에 들어간 학생들이라면 인정!근데...???,1
2861,km78****,"역시 검찰은 한몸 우리가 윤석열을 원했던 것은, 그는 검찰 개혁과 소신껏 하리라 믿었기 때문이다 그러나 그는 이제 정치의 한가운데 섰다 우리는 그를 지켜 볼 것이다. 배신하지 않기를 바란다.",1
2953,buff****,도대체 조국이 뭐길래 저런 범죄자 가족 얘기를 매일 뉴스에서 봐야하며 저걸 또 장관으로 임명한다는 대통령은 뭔가? 기자 간담회는 첨부터 끝까지 나는 모른다 일관되게 변명하는걸 무슨 의혹이 해소됐다고 거기에 편드는 여당 정신병자들을 보는것도 스트레스다!,1
1973,5982****,말만 나불거리지 말고 실질적인 것으로 대답해라!!! 경제지표 외교 국방 모든 것이 진퇴양난인데 이게 뭐하는 짓이냐!!!!!!,1
2215,서해바다,조국 걸래인간아 니가 장관한다고?♪♬♩♪♪~,0
184,krjo****,아이고 변호사 기다렸다잖아그러게 왜 변호사를 기다리는  ㅜㅜ검찰도 바보 .결국  ..배려 해주니.또 뒷통수.ㅜ무서운 가족들ㅜ,1
1739,euro****,굳이 기사를 내지않아도 모두 짐직하고 있고 알고 있다. 그냥 정권교체시기만 기다리며 산다.,1
2289,오십억원,처음부터 싹을 짤라라..엄마가 초등헉교 과제 도움 준부분 확인...  초등학교 압수 수사하고  의심증거 충분이 확보.. 초등학교 졸업 취소하면 됨...  자동적으로 중.고. 대학 자동 취소.  다 해결..뭐냐?  장관후보가 딸이야? 엄마야? 사모펀드로 1주일 열라 소설쓰더니..  이제 할말 없어니..애들 고.대학 다 디지냐?  중학교. 초등학교도 파헤져봐라...안나오면 유치원 까지..   유치원 선생에게 명절 선물 준거라도 나올거다..뇌물로 역걸거냐...별짖을 다한다..,0
285,저녁소,"모른다, 관여 안했다, 알고 관여한 건 사실이지만 그일에 대한 책임질 일은 않했다. 변명의 끝은 어디 인가요!!",0
2369,삶은 기적,"검찰개혁은 개혁이고, 조장관 일가 수사는 수사다.  반드시 별개로 해야한다.  대입 특권층의 비리가  있는지 확인는 해야한다. 일반 국민들은 자식 대학 보내려 뼈가 녹는다.",0
2916,jieu****,검찰은 계속 유출중 ㅋㅋㅋㅋㅋㅋ너네 죄짓고 있다ㅋ 그리고 동양대총장상 초딩이 받는거 기사에 나오든데?,1
1227,ksc7****,감싸는 인간들은 뭐냐 조국이 잘못 했으면 달게 벌을 받아야지 이게왜 보수냐 진보냐가 무슨 상관이있는가?  당신들 자식이 서울대 동양대  이런곳에서 스펙을 쌓을수나 있나? 더군다나 허위라면 이건 정유라는 게임도 안되는거구만  왜 금수저 새끼만 특별코스로 좋은대학 편법으로 가는것이 적폐고 공정과 정의를 뒤집은거다 서민들 모두가 피해입은 사건이고 금수저들의 일탈을 목격하고 있는거다,1
76,mooe****,이난국을 바로잡기위해 지식인들이 일어서야합니다. 이정권은 이래도 고집을 꺾지않고있습니다. 그야말로 신독재를 기획하는 집단입니다. 정권퇴진운동으로 타오르길 기대합니다.,1
2194,geni****,이러다 초등학교 아니 유치원 시절때 비리까지 나올거 같네요...어떻게 파면 팔수록 이런 비리들이 계속 나오는걸까요? 이들이 정도를 가르치는 부모였다면 이런 비리들은 저지르지 않았을텐데 말이죠...저런 부모가 아이들을 망친거겠죠? 그럼 저 아이들도 커서 자식을 어떻게 교육할지도 눈에 훤하네요...제발 이제라도 정신차리길 바랍니다..,1
176,jum6****,윤총장님 응원합니다. 서울대  연세대도 수사해 주세요.,1
674,팬더곰,"외국거주만으로 정원외 입학하는 전형은 없다가왜 두루뭉술한 답변? 그게 사실임외국 살다오면 외고입학함? 그런 경우 없음근데 왜때문에 조국은 거짓말쟁이, 조민은 시험이란걸 본적 없는 사람이 되버림노무현죽이기때와 비슷노건평이 권양숙에 전화해나에게 시계를 전해주라며 맡겼는데 어쩌냐하자권여사가 그걸 왜 받냐 돌려주라했고어찌 돌려줘야하는지 모른다 하니그럼 논에 갖다 버리든 알아서 하시라 함언론에선 검찰보도자료 받고 일제히'노무현 1억시계 논두렁에 버려' 대서특필지금도 노통이 1억시계 뇌물받은줄로 아는 사람 허다함",0
766,스칼렛,제목보게나~하도 언론서 떠들어대서 청문회  끝까지봄.조국에게 결격사유 하나도없더라.멍멍이처럼 짖어대는 한국당 추태에도인격적으로 답하는 조국후보자는대통령감이다.,0
363,topd****,광주버스네! 전라도 욕먹는 짓좀 그만해라?지역감정 없는 사람도 욕하겄다!!!~~,1
1001,너의바램,자한당도 똑같이 털꺼지?,0
2629,bestswallow,자칭 사회주의자라는 작자가  저거딸 입신양명만 주구장창 생각했냐?개가 웃을일이로세... 참 나....,0
61,metalship,학생들의 조국퇴진집회를 보면 이땅의 정의가 살아있음을 보여준다!,0
1912,juni****,300명 뽑는데 개인정보까진 적어내는 거 이해한다 근데 질문도 적어내야 하고 거기다 전화 인터뷰까지 하고 이렇게 뽑힌 사람들이 무슨 질문을 하겠나? 날카로운 질문하고 곤란한 질문 할 사람은 다 걸러지고 없지 그러니 팬미팅 소리가 나오는거고 ㅉㅉ 이럴 줄 알았다,1
993,zzzg****,"문재인 저런인간인줄 몰랐다는 듯이 말하네... 그러니 개돼지 소리 듣는거지 ㅉㅉ 대선토론만 봐도 뼛속까지 시뻘건 ㅃㄱㅇ였는데 지들이 뽑아놓고 이제와서 빼애애액 거리네. 자시고 폐지, 소득주도성장, 사법계혁 전부 공략이었다 개돼지들아",1
256,장미,조씨일가 입만열면거짓과 위선이다빨리 빵에 들어가서반성하길,0
141,김야곱,"●""가짜 제조기""""가족사기단""鄭경심뇬 빨리구속하라!!!!",0
665,하루-라떼,허위사실 유포한 언론과 자유당의원들 모조리 고발하고 특히 국회의원들 다시는 그러지 못하도록 국회의원 특권 뺏어야 한다,0
1066,사랑하며 살기,조사는 철저히  해야지.,0
1411,grea****,.허위 인턴 근무 증명서 발급했다면 부탁한 사람도 쌍벌죄로 처벌해야하고 이것을 사용하여 의전원 합격 하였다면 입학 취소 하는것이 형평성이 맞는것이고 교육 부총리는 책임지고 조속하게 처리하는것이 정의 공정 공평한 처사 아닌가? 대학교도 동양대 위조 증명서로 입학했다면 대학교도 입학 취소 시키고 한영외고도 이런 방식이라면 입학 취소 시키면 정유라처럼 남는건 중졸학력뿐이다 이처럼 부정 입학하여 정식 합격해야할 젊은 사람이 불합격 처리 되었으면 이들 차점자들에게도 손해배상 해주어야 할것 아닌가?,1
2944,justice,정말 장관감투에 목숨걸었냐? 구질구질하게 사네,0
