,UserName,Contents,Label
869,선구자,최성해도정경심도 모두 구속 수사가 답이다.뻔뻔한 죄국빤뻔한 정경심그토록 가문의 영광인 장관에 올랐으니이젠사퇴해라! 역겹다!,0
2458,그 까이꺼,까더라 뉴스라면 뉴스논두렁시계가 생각난다.기레기 죽일새기들,0
852,청목,나경원아들  최성해 언론 수사해라  왜 이리 조용하나,0
413,pwy2****,문재인  정권 내년 총선 당선  20%  미만으로 야당이 압도적으로 이겨서 경제실정 외교실정 대북실정 안보실정 에 대한 책임을 물어 탄핵시켜야 합니다.,1
1133,jws,"대검 잘한다, 조져라 조져, 매국을 조국을 , 정신차릴때까지 조져라,간만에 검찰 , 밥값한다,좌익 빨갱이놈들 북으로 가라.",0
2484,gun0****,더 많은 젊은이들이  앞장서서 대한민국을 살리기 바랍니다.,1
1028,시베리아,잘한다법대로 원칙대로더러운  똥좀치우고가자조국 냄새가 역겹다,0
2913,시우,정의당 완장질 꼴사납다몇석 되지도 않으면서이곳저곳 권력질짜증난다,0
79,소나무,조국을 두둔하는 애들은 하루 일당 얼마니?,0
2666,dudw****,이젠 범죄자보고 대놓고 힘내란다 ㅋㅋㅋㅋㅋㅋㅋ,1
1892,deng****,검찰개혁이 본인과가족수호 군요!!!!!공수처폐지!!!!,1
1458,Justice,"겨우 표창장때문에 법무장관 아내를 공개소환으로 망신주고, 구속영장 쳐봐라!오늘은 200백만의 촛불이 모였지만,다음주는 5백만, 그 다음주는 천만 국민이 검찰과 사법부를 심판하러 모일거다!깨어있는 시민여러분!지치지 맙시다!포기하지 맙시다!이번에는 지켜냅시다!이번에는 검찰개혁 이뤄냅시다!우리가 바로 조국이기 때문입니다!",0
2072,wkdbdjsfhs,저런 파렴치가 일국의 법무장관을?또 저런 철면피를 임영하는 꼴통은 뭐야 도대체?지놈들 눈엔 국민은 안중에도 없구만.,0
1325,sjs5****,검찰조사 오래 걸린다고 검찰 탓하는 이해찬씨 보세요-- 대통령부터 법무부장관까지 그리고 판사마저 대놓고 수사방해 하는거 모르세요? 피의자 정경심부터 조국동생까지 요리조리 피하면서 시간 끄는거 안보이세요? 계좌압색이랑 휴대폰 압색영장만 발부해주었으면 진작에 끝장냈을 수사입니다.,1
1609,yametech,지난 두달 대통령 놀이 했잖아윤석열이위 아래 없이웃기는 짜장이야,0
2276,박 참,조국 거짓말대마왕,0
1578,다니엘리,하 기가막히네. 이제까지 법 어겨놓고 주둥이 터는 쓰레기.,0
2855,cowb****,청와대 민정수석에 대한 이런 의혹이 닭정권에서 일어났다면 더불당 의원 나리들 어떤 반응을 보였을까요??? 전라도와 광화문 광장은 연일 시위로 난리가 났을지도...,1
2772,하늘소,저격한것도 아니고 정의롭고 이성적으로 발언한 사람 저런 사람들이 이념을 떠나 정의로운 대한민국을 만드는 것 당신은 지도자가 될 자격이 있으십니다,0
2167,Kowhsi,검찰 하는 짓거리가  노무현  논두렁시즌2야.윤석렬이 너 뭐하냐?,0
1701,까치,윤석열의 외침!난 검찰 개혁의 1등 공신이외다.나를 통해 적나라한 검찰 권력의  부패상을 보았잖소.나를 통해 통치권자께 대드는 무례함도 보았잖소.나를 통해 토왜 정당과의 유착 관계도 보았잖소.나를 통해 받아쓰기 잘하는 쓰레기 언론도 보았잖소.나는 국민들이 인정하는 최대 밉상이외다.,0
847,다크,이게 바로 사학 비리다... 그냥 검찰 고발 하는 것이 답이다.,0
322,deff****,좃국이가 광복군이냐?광고할려거던 타이어바퀴에 넣어서해라 갈아 뭉게버리게 한심한 작자들.,1
220,pip5****,준놈은  구속~~~~ 받은 놈은 영장 기각~~기가 막히네,1
1333,suns****,명재권 너 같은 것도 판사냐? 아마 대한민국 역사에 조 국 다음으로 뻔뻔하고 최소한의 양심도 없는 쓰레기로 기록될거다 명재권 너같은 인간 쓰레기가 우리나라의 판사라는 것이 사법부의 치욕이다,1
1743,myu2****,징하다. 중딩기레기야! 니네 사주하고 썪은 간부들이나 탐사해봐.  여론왜곡은 니네가 더 악질아녀.. 쓰레기잡지.,1
2736,dia2****,"""정교수가 당시 영국 유학 중인 건 맞지만, 항시 영국에 있었던 건 아니고 딸의 유학 당시 미국에도 일정기간 머물렀다""고 하네....ㅋㅋㅋㅋ다른 사람이 이런 상황이라면 무엇이라고 비판[비난?]을 하실까? 갑자기 궁금해지네요",1
727,choisangyoel,법무장관 수행능력과 가족관리가 연관성이 그리 크다고 생각하냐?? 청문회 보니 조국 충분히 법무장관 감이다.,0
151,삼나재,조국 이사람 아직도 정닌 못차렷네법을 전공한자가 증빙서류 제출할태 직인없는것을제출하냐!이게 말이됩니까지금 당신 피해자라고 억지부리면서 이런 초등학생수준으로 검찰을 기만합니까?조국씨는 이기주의자인것 알고있죠,0
621,하얀섬,"저 서울대, 고대 기득권 자녀들의 당파적인 정치행위를 보세요. 이것들 자한당의 인사청문회에 앞으로 어떻게 나오나 보세요. 이것은 정유라 사건과 교묘히 오버랩시키시 위한 자한당의 플랜에 따라 움직이고 있는 반시민혁명세력의 준동으로 기록될 겁니다 반드시 이것들에게 항의 해야 합니다",0
1582,kmss****,정부가 원하는 공수처가 있었다면 이렇게 검찰 수사가 가능하고 실세들을 구속시킬수 있을까요개혁이란 말로 포장된 검찰개혁 공수처 설치 적극 반대한다,1
658,aaaa****,아파트 갈아타기는 봤어도 학교를 저렇게 갈아타는 건 처음 봤다. 그것도 시험 한번 안보고....,1
114,dahd****,10월 3일 광화문 문재인 조국 탄핵집회!!!,1
149,neul****,여성 두명 있으면 압수수색 도중에 장관 남편에게 전화하고 바꿔줘도 되나요?  압수수색 대강 해야 되나요??? 말장난 하지 마시오~~~ 조국 내려올때 같이 사퇴하시길~~~,1
1011,햇살,"더부러 미친것들  검찰이 지들편 서면 정의라 말하고 반대편 서면... 정치 검찰,,???  한심 한  저능아   더부러 더러운 놈들~!!",0
2055,엘리시온,나쁜 짓을 골라가면서 했네~! 사회 악의 뿌리야~! 양아치 같이~! 거짓과 사기를 밥먹듯이 하니 나라가 이꼴이지~!,0
2625,teni****,차라리 최순실의 시대가 좋았다,1
1243,ciel****,저런짓하고 누가 누굴 개혁한다는거지? 웃기는 인간분이네요..,1
2370,Yjkimsub,공수처 반드시 설치.검찰쿠테타 막는 유일한 길,0
622,myanny,가짜뉴스 처벌법 좀공수처 설치사법개혁친일청산토착왜구 몰아내고역사 바로 세우자조국힘내세요,0
1308,이미선,이인간들은숨쉬는것 빼고전부 거짓말비겁자 위선자,0
1787,sj2722,이게 나라인가????? 집권세력이 분열을 조장하는 이유가사회주의 완성을 위한  것인지 심히 의심스럽다.,0
569,야시,약간은 바른 말 한듯 한데조국 딸에 대한 펙트 체크는 좀더 하지 그랬냐!그리고 서울대 고려대 늬들은 현 입시제도의 수혜자들 집단이면서낯 부끄럽지 않냐?  각종 수시 전형으로 입학 특혜  누린 늬들이 조국 딸을  비판해?서울대총학생회장 새끼도 고교때 논문 1저자로되있두만 지논문은  문제 없었다고 광분?바른미래당 당원이었두만~ 늬들 선동해서개누리 잔당들에게 눈도장  찍고 정치판에뛰어들려고 하는 잔대가리가 딱 보인다!쯧쯧쯧,0
1007,맥아더,검찰은 법과원칙으로 수사하라 공정한수사. 모든국민들이 검찰을 응원할것이다 반드시 철저한수사를하라 국민들의명령이다,0
606,깨어있는시민,인턴합격보다 나경원 딸 스페셜올림픽 홍보대사  선정이 100배는 큰 불법행위,0
2437,ttal****,한국당  하늘이 주는 기회다.  전투적으로 제대로 해라,1
2828,moni****,문재인 씨가 잘 한것 한가지와 조구기 가 청렴한거 한가지만 알려줘요.  ㅡ 난 아무리 생각해도 잘 한것도 없고 더럽게만 보이네요.,1
2732,kingkong1211,어제 청문회를 보니 민주당의원중 진실을 그대로 말하는 사람은 금의원님 뿐인것 같습니다. 팩트와 상관없이 무조건 지지하고 자기합리화 시키는 국회의원들은 한국당뿐만 아니라 민주당에도 널려 있다는것을 보고 한탄스러웠습니다.금의원님의 소신 발언을 적극적으로 지지합니다.국민들도 자기가 지지하는 당이라고 무조건  맹신하지 말고여야를 떠나서 잘한것은 적극지지하고 잘못한것은 냉정히 비판하는 자세가 한국 정치를  살리는길입니다.,0
1329,four****,정명심 뇌경색 뇌종양도 조사해봐라.,1
2682,Freespirit,"문재인 정부자유민주주의 에서 자유삭제,사회주의자를 법무부장관으로 임명해야되는 이유; 뭘 제대로 하려면 법 이론부터 죄다 바꿔야 하니까 반정부단체든 개인이든 시위하면 법을 내세워 잡아가둬야하니까절대권력=독재=탄압=부패=공산당=악",0
2218,blue****,정유라의 죄는 엄마 최순실이 법조인이 아니었다는 거였군.,1
446,박영필,조국.거짖말.제처와.저는주식을모릅니다.,0
2403,nosh****,문재인 정권의 실세중의 실세. 문재인이 늘 믿는다던 사람. 최측근이리고 늘 떠벌리던 사람 그게 조국이다. 근데 조국조차 이 수많은 의혹들에 관련이없다고? 2030이 선택적 분노를 한다고? 하. 조국딸과 조국을 나누고 조국과 문재인을 나누는게 선택적이다.,1
1208,ppk3****,용기있는 석렬 총장님 박전대통령 할때같이 해봐라 용두사미 되지말고 적극 응원한다.조국부부 깜방 보내면 다음에는 누군지 잘알지.,1
2431,라인강,"앞으로 장관정도 하려면, 예수, 부처 이상의 도덕성을 갖추고, 자녀의 상장, 표창장까지도 검찰조사해서 진위를 밝히고 조금이라도 결함이 발견되면 낙마시켜라.",0
2811,제사장,야들의 기준 내.로.남.불,0
2926,dani****,",총장상이 아니라 정경심상이네",1
2807,oks6****,조국을 완전분해해서 정밀하게 조사해주세요 나 살다살다 이렇게 빤빤한거 처음봅니다 인간이 아닙니다 인조인간인지도 조사해주세요,1
2440,kim4****,솔까 홍준표가 말은 거칠고 사탕발림 감성언행은 못하지만 따지고 보면 맞는말 했었음. 정작 공약은 안보고 감성선동에 혹해서 인기끌기식 연예인 인기투표하는 개돼지들이 많아서 문정부가 출범된거지ㅋㅋㅋ,1
1013,bib8****,운동권se퀴들 학창시절 하라는 공부는 안하고 간첩 공작에 휘말려 김일성주체사상이나 맑시즘에 빠져 자본주의는 무조건 나쁜것이다라고 세뇌되어 길거리에서 복면 쓰고 화염병이나 던지던 세상에 나오지 말았어야 할 개 쓰레기들,1
2329,moni****,쓰레기통에 버려야 할 인간을 곁에두고 정치에 이용 해먹을려는 문씨가 더 큰 문제다.,1
438,jwle****,장하성 재산 104억원. 소주성 해서 벌었나? 생각이 없는 개돼지들아!<U+0001F415><U+0001F415><U+0001F415>,1
2957,sdsy****,서울시 1500억원대 와이파업 사업에 범여권인사들이 개입된 정황!  사전정보 유출로 잇권사업 개입?  조국 지키기 혈안! 답 나온다. 더불당과청와대야!,1
1363,원한익,가증스런놈 증거가차고넘치는데 도모른다 몰랐다?온나라를두달동안이나 죽탕질을치는데 라이언일병구하기처럼날뛰는여당놈들은 내년총선준비는 할필요도없겠구나!,0
2003,jungwoo,깨끗한척은 혼자 다하더니아주 드러운놈이었네,0
2392,.,총장님 힘내시고 조국구속시키세요,0
2307,gksc****,내년 총선 보여줍시다 국민여러분. 국민이 이나라 주인이라는걸 보여줍시다. 민주당 박살냅시다 여러분. 저 자한당 싫습니다. 그러나 민주당과 정의당은 더 싫습니다. 한번만 자한당과 바른미래당 밀어줍시다. 우리나라 병들게하는 좌파세력부터 완전 박멸하고 대한민국 다시 시작합시다 여러분. 다음 총선에 민주당 한석도 주면 안됩니다.,1
1881,yjsr****,문재인은 이런 짓도 모자라서 직접 법무부에 검찰을 더 옥죄라고 오더 내리는가! 문정권이 지은 죄가 많아 검찰 힘을 확실히 빼버리려 검찰개혁이란 명목으로 검찰 조직을 와해시키는구나!,1
1279,sunn****,한집에 생활하는 부부가 이렇게 철저하게 한사람 모르게 일처리 할 수 있다고 생각 하십니까? 일반 가정만 놓고 보아도 ....,1
2060,왕소니,문재인 정권의 내로남불 끝판왕 조국?도대체 이 정권의 비리는 어디까지가 끝인가?최순실 비리는 조국에 비하면 새발의 피네.,0
2165,pmj_****,이걸보니 숙명여고 쌍둥이 아빠도 측은하네... 이렇게하면 될 일을 권력이 부족해서...,1
523,학생,"""K"" ... 누군진 모르지만 ... 참 균형감각 있는 합리적 사고의 소유자네 ~~차기 지도자감으로 무럭무럭 성장하길 바랍니다. 서울대 ~~~ 아직 솨라있네 !!! ㅎㅎㅎ 지금 무개념으로 설치는 총학회장은 ...수시전형의 폐혜를 보여주는 표본임 ~그런 어설픈 미성숙 문제 인식 사고로 무슨 지성의 전당 서울대를 대표하냐 ???어서 내려와라 ~~ 서울대 먹칠하지말고 ~~~",0
852,hwk0****,역시 서울대생들 최고입니다.응원합니다!,1
702,kohi****,조선일보이니까 정말 댓글 달기 싫은데....대학 PC를 집에 가져갔다고?그럼 절도범이 딜텐데...학교 기물은 망가진 가습기도 수거해가던데...말도 안된다.그나마도 조국이 써주었나봐.정말 으악이다~~~,1
618,lzmn****,현 정권은 국민을 개돼지로 보고 조국 게이트를 그냥 저냥 하면 넘어갈 수 있는 간단한 문제라고 생각한다. 문제의 실체를 보는 국민들에게 진영 논리를 대며 정치 프레임으로 몰아가고 있다. 정신차려라 정부야! 너희들이 예전 독재 정부가 모든 문제를 공산당과 빨갱이 프레임으로 씌운 것과 뭐가 다르냐? 이번에 너희 뜻대로 임명을 밀어 부치면 절대로 국민들은 가만히 있지 않을 것이다. 촛불 때도 정치 개입 없겠다고 해놓고 마지막에 들어와서 숟가락 얹고 정권 잡은 주제에 감히 민주주의를 욕보려고 해?,1
348,mnbv****,조국 찬성 독보적인 30대 김치년들. 정치인이 아니라 얼굴빠는 미친 여자들 부끄러운줄도 모르구 나라 망치는 짓거리하구 있어,1
2942,블루스카이,운동권  사람은 가진것은  없어도  정정당당 하게  할 말 하고  청렴 하는데   심싱정이 보면  토나온다기생충  주인공!,0
2755,cpam****,인생 자체가 꼼수네 꼼수. ㅋㅋㅋㅋㅋㅋㅋㅋㅋㅋㅋㅋ 역시 조씨는 변변찮은 인물이 진짜 별로 없어. ㅎ,1
87,1574****,말없는 다수의 지식인이 움직이기 시작했다.그간 촉새들이  범람하며  지상의  전당을   오몀시켜던게  사실이다.,1
2212,camu****,온 우주가 조국 딸 의사 만들기에 동참해주었네,1
1203,킬리만자로의표범,대통령의  인사권까지 무력화 하려는 검찰의 오만방자한  항명사태를 보면서 공수처  설치 가 왜 필요한지 다시한번 실감케한다.,0
240,영원한사랑,조국이 구속 수사 해라비리자가 무슨 대학에서 강의야학생들이 비리 요령 배울려고 강의 듣는것도 아니고 아주 질이 나뿐 놈,0
1320,good****,가족 사기단,1
2756,니나,금태섭의원님 같이 진정한 소리를 내시는분이   국민을위한 국회의원이십니다힘내세요,0
1674,rule****,"문재인이라는 5년제 공무원이 나라를 제것인양 멋대로 주무르고 있다....잘되는게 하나도 없다....민족의 이름으로,,,꼰대좌파 수장 문재인을 검찰수사방해 국정농단죄로 탄핵,,구속시켜라,,,,",1
715,ZiZiANa,아니 웃긴건 나라에.큰 난리 있을땐 조개 마냥 입 다물고 있더만 지금은 뭐냐?? 생각을 좀 해라 이것들아,0
2633,안티프라민,강남좌파자유주의자사회주의자~늘 빠져나갈 구멍이 있는 사람~,0
624,urbanus,어이 경향기레기.  학교 취재해보면 금방 나올 이런 기사를 온갖가짜뉴스가 다 배포되고 난 이후에 올리는 이유가 멉니까? 기자면 기자답게 정확한 사실보도를 해야지 언론인으로써 부끄러운줄 아시길..,0
2673,jega****,조작아닌가? 40대에 힘내라가 더 많다고?  당췌 어디에 있지?  내 주변에는 없는데...저걸 힘내라고 옹호하는 호갱이 있다니...장님이 따로 없군...,1
2569,희망소년,"가짜, 조작, 거짓...뻔뻔.조후보자를 따라디니는 ..국민의 붅노는 점점끓고있다.",0
1709,곰발바닥,조국장관에게 고한다...당신은 이제 어쩔수없이 이 많은 국민들을 다 짊어지고 시대의 사명을 완수하기위해 앞으로 나아가야한다.....국민이 부르고 역사가 개혁을 외치고 있다. 이흐름을 거부하는 자는 시대를 거스러는 역린이 될것이다...힘드시드라도 앞으로가달라고 할수밖에 없는 우리들도  다만 죄송할따름입니다......,0
2443,흰둥이,조국조카및 직원들 죄를지어  도피중이아니라면 왜 아직까지 계속 안들어오고있나?의심스러운 정황이다. 조국 사모펀드 제대로 수사해라,0
262,내일은,나는 모른다몰랐다좌레기들이쉴드쳐줄거니맘대로해라아니면어디아프면되니까걱정없다,0
765,체게바라,한경오  언론는 죽었다,0
432,2790****,더불당  좌파 국민들이 응징하고분노해서 심판한다이게나라다운나라냐 이게촟물정권이냐 살아있는권력도 조사하라든게 문재인 탄핵하자 이게나라다운나라냐 이게촟물정권이냐,1
2539,어른답게살자,"아이를 자사고에 보냈던 학부모입니다 청문회에서 민주당 의원들이 조국 딸 입학한 해 포함 이후 3년간 SKY에 수시 전형으로 들어간 외고 자사고 특목고 학생들 모두의 전수 조사를 주장하고 관철시켜야 한다고 생각합니다! 그리고 그 시기 장관급 이상을 한 고위 공직자들 자녀의 출신고, SKY 수시 전형 합격 여부,  수시 합격 시 전수 조사 실시 주장해주세요! 그 결과 조국 딸과 비슷한 의혹나온 사람들 검찰이 다 압수 수색해야 합니다!  그래야 진정한 정의 평등이죠!!",0
2569,maro****,조민 제1저자 논문만봐도 찬성하는 놈은 대깨문이다 정상인들은 정당 떠나서 분노함,1
1354,mart****,구라를 치려면 적어도  cctv앞에서 한 번정도 자빠지기도 하고 해야지~~ 짜식이 성의가없어!!! 근성도 없고!!!,1
1926,jasp****,김경수 드루킹 여론조작으로 되어 나라 안보 경제 인사 교육 진영 분열시킨 무능하고  자격없는 사람으로 국민들이 알아 차린걸 모르나!,1
221,Kim,얘는 최순실보다 더한 악랄이다!! 이렇게 더러운 자는 역사상 없었다!! 진짜 희대의 사기꾼이다!,0
1824,kmh2****,"미쳐버릴 정도로 짜증나요. 저런 사람을 정의롭다고 믿고 지지했다니. 우리나라 최고로 내로남불이며, 전국민을 상대로 공공연하게 사기를 친 최악이에요!",1
1686,junn****,어제와 오늘 새벽까지 어마어마했습니다.추운 날씨에 고생을 마다 하지 않은 애국시민들 고개숙여 경의를 표합니다,1
1355,잘된다,또  받아쓰기 ! 받아쓰기만 하는게  기자라고?부끄러움도 모르는  인간말종들.,0
2837,jjan****,꼭 잡아내 주세요! 이런 인간이 이나라의 권력을 쥐고 국민들 앞에서 고개 들수 없도록 해주시길 바랍니다.,1
1312,sinb****,이분들 쉴드치다가 정권 하나가 내려앉음. 아직도 언론과 검찰을 까시는 분들... 여러분 한분 한분이 민주당과 현직 대통령을 내려앉게 하고 있다는게 사실입니다.,1
500,01dk****,대한민국의 희망 대학생들 응원 합니다 파이팅 ~~~,1
558,wsyz****,국민은 부패조국씨족들을 위해서 존재하는것이 아니다ㆍ자아실현을 위해서  존재하는것이다ㆍ비리조국씨족을 위한  노예근성ㆍ마당쇠근성을 버리고  자아실현을 위한 정의로운 인생을  살아라 ㆍ옳고 그름을  판단하지 못하는  어리석은  인생을 버려라ㆍ검찰개혁운운하는것은  가짜다ㆍ그들의 검찰개혁운운은  부패씨족 조국을 위한  가짜 검찰개혁이다ㆍ비리 조국비호하는것이 쪽팔려서  검찰개혁 운운하는  가짜 검찰개혁이다ㆍ조국집안은  비리백화점이다ㆍ쪽팔리게  조국비호  하는 짓 그만 하라 ㆍ마당쇠근성ㆍ조국집안의 노예근성 버려라 ㆍ쪽팔리는 짓 그만하라,1
2578,ubuman,"숨 쉬는 거 빼고 다 거짓말이야~~~~예상 했던 데로 네////// ㅋㅋㅋㅋㅋㅋㅋㅋ알고 저렇게 하는 거 맞지////// 아니면//// 정신 병자지/////ㅋㅋㅋㅋㅋㅋㅋ거짓말 쟁이 민정수석, 서울대 교수??? 정신병자 민정수석, 서울대 교수// 이었네////ㅋㅋㅋㅋㅋ",0
2985,gkrt****,문재인이 나쁜새기지 하자있어도 지들입맛에맞게 개혁만하면된다 이거지,1
1843,쥐모가지싹뚝,김어준 유시민 없었으면 어쩔뻔 했나제2의 논두렁시계 될뻔 했어,0
291,메추리,원래 빨갱이들은 고발하고 거짓말밖에 힐줄  모르지,0
1323,jbhs****,"그냥 일반 사람[국민]들에게 하던대로 수사하고 영장청구하고 기소하세요. 뭘 따로 고려할 필요없잖아요. 국민들은 그런걸 원하는 것 같은데. 지금 윗사람, 권력자 눈치보는 걸 국민들은 원치 않아요.",1
1490,bestjungi,나라에 정의가사라졌다내로남불이 법이고촛불이 법이다문죄인이 법이고더불당이 법이다헌법은 어디로갔나떼거리로 모이면 법도헌법도초월하는  정말 창피하다ㆍ우리법연구회의실적이 현실로나타난다국민  은없다광 화 문에   모이면  다된다 ♪♪ 이런 나라가나라가 ㆍ이게 나라가   ㆍ내로남불로민족사 가두동강났네,0
800,tlsr****,문재인 탄핵,1
1064,lwj1****,"대전엔 안희정,허태정, 박영순, ,,,, 등등  대학땐 수업도 거의 안듣고 데모만하다 정치 한답시고 죽치다 노, 문정권 만나 벼락  기용돼서 팔자 고친 평생 백수 건달들,,",1
925,guyg****,조국이 시 키가 조범동이 미리 빼돌린 거지. 조범동이도 불쌍하다. 삼촌한테 충성했는데 이젠 버림받아 국제 미아 되버렸네. 걍 들어와서 양심선언해라. 주범은 조국이라고.,1
1766,YNWA퍼스,집회 참여하신 모든 분들 진정한 대한민국의 애국자이십니다.,0
2420,롱롱,조국은 정말 재산 늘리는데... 관심이 없었네요5촌 조카 도망간 이유가 이거였어...친인척도 믿을수가없군요,0
2524,헌정,"조국은 진보가 아니다.진보라면 모름지기 자기나 자기 가족보다 이 사회의 그늘진 곳, 어려운 삶을 사는 사람을 먼저 생각해야 한다.아니, 적어도 반칙을 저질러가며 가난하고 힘든 사람을 더 힘들게 하진 않아야 한다.그런데 이 자식은 어려운 사람, 시름 속에 사는 사람을 위하는 척 개소리 풀고 자기 이익을 꾀한 가짜다.아니 '진보팔이' 사기꾼이다.",0
592,smsm****,이번 사태를 계기로 문재인 조국 유시민 공지영 문재관  박훈 등이 어떤 사람들인지 확실하게 알게 해줬다,1
3089,angel,"역사이래...   스스로 권력을 내려놓은 지배자는 극히 찾아보기 어려운듯...     대부분,  죽임을 당하거나 혁명에 의해 끌려내려왔지.",0
2412,kwan****,내가 30대인데 자유한당이 좋아서 참여한게 아니라 문정권이 민주노총놈들과 붙어먹고 민생경제 다 말아쳐먹어 서민들 피말라 죽이는 정책만해서 승질이나서 참가했다 이게 진짜 팩트다,1
2889,sea3****,입은 사회주의인데 몸은 자본주의..,1
2067,duck****,저거바라. 나라를 위한 정치할 생각은 1도 없고 오로지 정권 잡을 생각만 하고 있으니 나라가 산으로 가지. 북으로만 보내지 마라. 제발,1
985,kors24,노무현 죽인 검사들 이젠 막 나가는구나 저것들 개혁 하라구 보낸게 조국이다 끝까지 살아 남아서 한국당과 졸개 검사들 쓸어버리자,0
1340,mare****,이자까지해서 128억이란다..그걸 배짼건데..이걸 어찌 냅두겠냐?그것도 우리가 세금으로 낸 나랏돈을 대출해간거다,1
1439,열세시,내 이럴 줄 알았다. 조국과 그 가족이 힘없이 일방적으로 개검과 기레기들에게 융단폭격 당할 때 예상했다. 언론이 다 들고 일어나면 국민이 진실을 모를줄 알고 마음대로 한 가족을 1달 반이나 괴롭히고 모욕하다가 국민의 격노를 부를 줄 알았다.,0
